{
  "$id": "urn:ratatoskr:contracts:ai_archive:v1:AiProject",
  "$schema": "https://json-schema.org/draft/2020-12/schema",
  "title": "AiProject",
  "description": "One normalized project node.\n\nProjects group conversations. Every field is either Ratatoskr's own identity, an explicit\nprovider reference, or provider-authored content; nothing is inferred.",
  "type": "object",
  "properties": {
    "ai_project_id": {
      "description": "Ratatoskr's own identity for this project, stable across re-imports of the same export\nevidence. Bare canonical UUID on the wire; never derived from the provider's id.",
      "$ref": "#/$defs/AiProjectId"
    },
    "description": {
      "description": "The project description, when the export supplies one.",
      "anyOf": [
        {
          "$ref": "#/$defs/AiText"
        },
        {
          "type": "null"
        }
      ]
    },
    "external_project_id": {
      "description": "The provider's id for the project, when the export supplies one. Opaque and\ncase-sensitive; deduplication keys on `provider` plus this value.",
      "anyOf": [
        {
          "$ref": "#/$defs/EntityLocalId"
        },
        {
          "type": "null"
        }
      ]
    },
    "instructions": {
      "description": "The project's standing instructions, when the export supplies them.",
      "anyOf": [
        {
          "$ref": "#/$defs/AiText"
        },
        {
          "type": "null"
        }
      ]
    },
    "parser_name": {
      "description": "Which parser build normalized this node.",
      "$ref": "#/$defs/ParserName"
    },
    "parser_version": {
      "description": "The build of [`AiProject::parser_name`].",
      "$ref": "#/$defs/ParserVersion"
    },
    "provider": {
      "description": "The provider the project belongs to. Open token.",
      "$ref": "#/$defs/AiProvider"
    },
    "provider_created_at": {
      "description": "Instant the provider says the project was created. Provider-authored: present only when\nthe export supplied it, never inferred.",
      "anyOf": [
        {
          "$ref": "#/$defs/WireTimestamp"
        },
        {
          "type": "null"
        }
      ]
    },
    "provider_updated_at": {
      "description": "Instant the provider says the project last changed. Provider-authored on the same terms.",
      "anyOf": [
        {
          "$ref": "#/$defs/WireTimestamp"
        },
        {
          "type": "null"
        }
      ]
    },
    "title": {
      "description": "The project's title.",
      "$ref": "#/$defs/AiTitle"
    }
  },
  "additionalProperties": true,
  "required": [
    "ai_project_id",
    "parser_name",
    "parser_version",
    "provider",
    "title"
  ],
  "x-ratatoskr-provenance": {
    "canonical_source": "ratatoskr_ai_archive_contracts::AiProject",
    "contract_id": "ai_archive.project",
    "contract_major_version": 1,
    "generated": "DO NOT EDIT — generated by contractsc from the canonical Rust source. Change the Rust type and run `cargo contracts generate`.",
    "generator": "contractsc",
    "generator_version": "0.1.0",
    "schemars_version": "1.2.2",
    "source_digest": "sha256:f1d7ca7a4f07448fe9046b6f2df1e613b1b4a0d3d72f47bfe7d3979d856c7e22",
    "validation_note": "This schema is a LOWER BOUND on validity. Cross-field invariants and canonical-form rules are enforced by the canonical Rust type; see fixtures/invalid-expectations.toml for which layer rejects what."
  },
  "x-ratatoskr-unknown-policy": "preserve",
  "$defs": {
    "AiProjectId": {
      "title": "AiProjectId",
      "description": "Identity of one normalized AI project. Bare canonical lowercase hyphenated UUID; not namespaced.",
      "type": "string",
      "format": "uuid",
      "examples": [
        "018f0000-0000-7000-8000-000000000001"
      ],
      "pattern": "^[0-9a-f]{8}-[0-9a-f]{4}-[0-9a-f]{4}-[0-9a-f]{4}-[0-9a-f]{12}$"
    },
    "AiProvider": {
      "title": "AiProvider",
      "description": "The AI provider an archive came from, e.g. `chatgpt`, `claude`.\n\n**Open on purpose.** A validated token, not an enum: a provider added by a later milestone\nmust not break a running consumer, and no consumer may assume the vocabulary is\nexhaustive. Branch on equality with known tokens; treat everything else generically. The\ngrammar is the event-type segment grammar (`EventType::SEGMENT_PATTERN`), so one\nsnake_case alphabet covers both.",
      "type": "string",
      "examples": [
        "chatgpt",
        "claude"
      ],
      "maxLength": 32,
      "pattern": "^[a-z][a-z0-9_]{0,31}$"
    },
    "AiText": {
      "title": "AiText",
      "description": "Multi-line normalized text: project instructions and descriptions.\n\nLine breaks are content and survive verbatim (`\\n`, `\\r\\n`, `\\t`); every other C0\ncontrol and DEL is banned so text cannot smuggle terminal escapes into a renderer. The\nupper bound lives in `MAX_LEN` rather than the pattern: a bounded repetition that large\ndoes not compile, and the newtype already rejects over-long input before the pattern\nruns.",
      "type": "string",
      "examples": [
        "first line\nsecond line"
      ],
      "maxLength": 65536,
      "pattern": "^[^\\x00-\\x08\\x0b\\x0c\\x0e-\\x1f\\x7f]+$"
    },
    "AiTitle": {
      "title": "AiTitle",
      "description": "A provider- or user-authored single-line title of a project or conversation.\n\nControl characters are banned so a title cannot forge log lines; every other Unicode is\ncontent. Not machine-parsed; consumers never branch on it.",
      "type": "string",
      "examples": [
        "Rust ownership notes"
      ],
      "maxLength": 256,
      "pattern": "^[^\\x00-\\x1f\\x7f]{1,256}$"
    },
    "EntityLocalId": {
      "title": "EntityLocalId",
      "description": "The identity half of a qualified reference. Opaque: a UUID, a provider's numeric string,\nor a provider slug. May contain `:`, because the kind separator is the FIRST colon only.",
      "type": "string",
      "examples": [
        "018f0000-0000-7000-8000-000000000002",
        "123"
      ],
      "maxLength": 256,
      "pattern": "^[A-Za-z0-9][A-Za-z0-9._~:@+-]{0,255}$"
    },
    "ParserName": {
      "title": "ParserName",
      "description": "Which parser normalized a node, e.g. `chatgpt_export`, `claude_export`.\n\n**Open on purpose**, like [`AiProvider`]: a parser rename or addition must not break a\nrunning consumer. Opaque to consumers beyond display and staleness comparison; no\nconsumer may branch on its internals.\n\n[`AiProvider`]: crate::AiProvider",
      "type": "string",
      "examples": [
        "chatgpt_export",
        "claude_export"
      ],
      "maxLength": 32,
      "pattern": "^[a-z][a-z0-9_]{0,31}$"
    },
    "ParserVersion": {
      "title": "ParserVersion",
      "description": "The build of the [`ParserName`] that normalized a node.\n\nBounded printable ASCII without whitespace: semver (`1.4.2`), date-based (`2026.08.1`)\nand commit-sha spellings all fit. Deliberately **not** semver-typed — parsers version in\nmore than one scheme, and any tighter grammar would reject an honest stamp. Consumers MAY\ncompare stamps for staleness; none may parse them for semantics.\n\n[`ParserName`]: crate::ParserName",
      "type": "string",
      "examples": [
        "1.4.2",
        "2026.08.1"
      ],
      "maxLength": 64,
      "pattern": "^[!-~]{1,64}$"
    },
    "WireTimestamp": {
      "title": "WireTimestamp",
      "description": "An instant on the wire: RFC 3339 in UTC with the literal `Z` designator. Exactly one spelling is accepted per instant — an input that does not re-render to itself is rejected. The field holding it declares the clock authority.",
      "type": "string",
      "format": "date-time",
      "examples": [
        "2026-08-17T10:00:00Z"
      ],
      "pattern": "^\\d{4}-\\d{2}-\\d{2}T\\d{2}:\\d{2}:\\d{2}(\\.\\d{1,9})?Z$"
    }
  }
}
